,director_name,actor_1_name,actor_2_name,actor_3_name,genres,movie_title,comb
2395,Robert Luketic,Linda Cardellini,Raquel Welch,Alanna Ubach,Comedy Romance,legally blonde,Linda Cardellini Raquel Welch Alanna Ubach Robert Luketic Comedy Romance
2396,Leonard Nimoy,Leonard Nimoy,Nichelle Nichols,Walter Koenig,Action Adventure Sci-Fi,star trek iii: the search for spock,Leonard Nimoy Nichelle Nichols Walter Koenig Leonard Nimoy Action Adventure Sci-Fi
2397,Scott Derrickson,Tom Wilkinson,Colm Feore,JR Bourne,Drama Horror Thriller,the exorcism of emily rose,Tom Wilkinson Colm Feore JR Bourne Scott Derrickson Drama Horror Thriller
2398,Mike Mitchell,Amy Poehler,Eddie Griffin,Bree Turner,Comedy Romance,deuce bigalow: male gigolo,Amy Poehler Eddie Griffin Bree Turner Mike Mitchell Comedy Romance
2399,Vic Armstrong,Nicolas Cage,Lea Thompson,Quinton Aaron,Action Drama Fantasy Mystery Thriller,left behind,Nicolas Cage Lea Thompson Quinton Aaron Vic Armstrong Action Drama Fantasy Mystery Thriller
2400,Thomas Bezucha,Craig T. Nelson,Paul Schneider,Tyrone Giordano,Comedy Drama Romance,the family stone,Craig T. Nelson Paul Schneider Tyrone Giordano Thomas Bezucha Comedy Drama Romance
2401,Kevin Rodney Sullivan,Harry Lennix,Sean Patrick Thomas,Kenan Thompson,Comedy Drama,barbershop 2: back in business,Harry Lennix Sean Patrick Thomas Kenan Thompson Kevin Rodney Sullivan Comedy Drama
2402,Terry Zwigoff,Bernie Mac,Tony Cox,Alex Borstein,Comedy Crime Drama,bad santa,Bernie Mac Tony Cox Alex Borstein Terry Zwigoff Comedy Crime Drama
2403,Jay Roach,Will Ferrell,Charles Napier,Robert Wagner,Comedy Crime,austin powers: international man of mystery,Will Ferrell Charles Napier Robert Wagner Jay Roach Comedy Crime
2404,Kirk Jones,Nia Vardalos,Louis Mandylor,Joey Fatone,Comedy Family Romance,my big fat greek wedding 2,Nia Vardalos Louis Mandylor Joey Fatone Kirk Jones Comedy Family Romance
2405,David Bowers,Zachary Gordon,Rachael Harris,Fran Kranz,Comedy Family,diary of a wimpy kid: rodrick rules,Zachary Gordon Rachael Harris Fran Kranz David Bowers Comedy Family
2406,John McTiernan,Shane Black,Bill Duke,Carl Weathers,Action Horror Sci-Fi,predator,Shane Black Bill Duke Carl Weathers John McTiernan Action Horror Sci-Fi
2407,Milos Forman,Jeffrey Jones,F. Murray Abraham,Tom Hulce,Biography Drama History Music,amadeus,Jeffrey Jones F. Murray Abraham Tom Hulce Milos Forman Biography Drama History Music
2408,Nelson McCormick,Ming-Na Wen,Scott Porter,Collins Pennie,Horror Mystery,prom night,Ming-Na Wen Scott Porter Collins Pennie Nelson McCormick Horror Mystery
2409,Mark Waters,Tina Fey,Amy Poehler,Neil Flynn,Comedy,mean girls,Tina Fey Amy Poehler Neil Flynn Mark Waters Comedy
2410,Audrey Wells,Raoul Bova,Lindsay Duncan,Mario Monicelli,Comedy Drama Romance,under the tuscan sun,Raoul Bova Lindsay Duncan Mario Monicelli Audrey Wells Comedy Drama Romance
2411,Robert Altman,Kristin Scott Thomas,Bob Balaban,Tom Hollander,Drama Mystery,gosford park,Kristin Scott Thomas Bob Balaban Tom Hollander Robert Altman Drama Mystery
2412,unknown,Peter Gallagher,Melinda Clarke,Tate Donovan,Comedy Drama Romance,the o.c.            ,Peter Gallagher Melinda Clarke Tate Donovan unknown Comedy Drama Romance
2413,Francis Ford Coppola,Nicolas Cage,Kathleen Turner,Joan Allen,Comedy Drama Fantasy Romance,peggy sue got married,Nicolas Cage Kathleen Turner Joan Allen Francis Ford Coppola Comedy Drama Fantasy Romance
2414,Alejandro G. Iñárritu,Emma Stone,Naomi Watts,Merritt Wever,Comedy Drama Romance,birdman or (the unexpected virtue of ignorance),Emma Stone Naomi Watts Merritt Wever Alejandro G. Iñárritu Comedy Drama Romance
2415,Woody Allen,Sally Hawkins,Charlie Tahan,Andrew Dice Clay,Drama,blue jasmine,Sally Hawkins Charlie Tahan Andrew Dice Clay Woody Allen Drama
2416,Paul Greengrass,Christian Clemenson,David Alan Basche,Susan Blommaert,Drama History Thriller,united 93,Christian Clemenson David Alan Basche Susan Blommaert Paul Greengrass Drama History Thriller
2417,Bille Woodruff,Christian Monzon,Mekhi Phifer,Romeo Miller,Drama Music Romance,honey,Christian Monzon Mekhi Phifer Romeo Miller Bille Woodruff Drama Music Romance
2418,Edward Zwick,Denzel Washington,Morgan Freeman,Matthew Broderick,Drama History War,glory,Denzel Washington Morgan Freeman Matthew Broderick Edward Zwick Drama History War
2419,Rick Friedberg,Hulk Hogan,Barry Bostwick,Nicollette Sheridan,Action Comedy,spy hard,Hulk Hogan Barry Bostwick Nicollette Sheridan Rick Friedberg Action Comedy
2420,John Carpenter,Jamie Lee Curtis,Hal Holbrook,Janet Leigh,Fantasy Horror,the fog,Jamie Lee Curtis Hal Holbrook Janet Leigh John Carpenter Fantasy Horror
2421,Sean McNamara,Dennis Quaid,Chris Brochu,Craig T. Nelson,Biography Drama Family Sport,soul surfer,Dennis Quaid Chris Brochu Craig T. Nelson Sean McNamara Biography Drama Family Sport
2422,Mike Nichols,Bob Newhart,Bob Balaban,Martin Balsam,Comedy Drama War,catch-22,Bob Newhart Bob Balaban Martin Balsam Mike Nichols Comedy Drama War
2423,Jody Hill,Collette Wolfe,Celia Weston,Dan Bakkedahl,Comedy Crime Drama,observe and report,Collette Wolfe Celia Weston Dan Bakkedahl Jody Hill Comedy Crime Drama
2424,Richard Fleischer,Mako,Olivia d'Abo,Grace Jones,Action Adventure Fantasy,conan the destroyer,Mako Olivia d'Abo Grace Jones Richard Fleischer Action Adventure Fantasy
2425,Martin Scorsese,Robert De Niro,Cathy Moriarty,Frank Vincent,Biography Drama Sport,raging bull,Robert De Niro Cathy Moriarty Frank Vincent Martin Scorsese Biography Drama Sport
2426,Brandon Camp,Judy Greer,Sasha Alexander,Frances Conroy,Drama Romance,love happens,Judy Greer Sasha Alexander Frances Conroy Brandon Camp Drama Romance
2427,Barry Levinson,Nicholas Rowe,Roger Ashton-Griffiths,Freddie Jones,Adventure Fantasy Mystery Thriller,young sherlock holmes,Nicholas Rowe Roger Ashton-Griffiths Freddie Jones Barry Levinson Adventure Fantasy Mystery Thriller
2428,Kevin Tancharoen,Kelsey Grammer,Kay Panabaker,Megan Mullally,Comedy Drama Musical Romance,fame,Kelsey Grammer Kay Panabaker Megan Mullally Kevin Tancharoen Comedy Drama Musical Romance
2429,Danny Boyle,James Franco,Treat Williams,Kate Burton,Adventure Biography Drama Thriller,127 hours,James Franco Treat Williams Kate Burton Danny Boyle Adventure Biography Drama Thriller
2430,Woody Allen,Woody Allen,Jon Lovitz,Michael Rapaport,Comedy Crime,small time crooks,Woody Allen Jon Lovitz Michael Rapaport Woody Allen Comedy Crime
2431,Nicholas Hytner,Amanda Schull,Susan May Pratt,Ethan Stiefel,Drama Music Romance,center stage,Amanda Schull Susan May Pratt Ethan Stiefel Nicholas Hytner Drama Music Romance
2432,Jessie Nelson,Olivia Wilde,Alex Borstein,Timothée Chalamet,Comedy,love the coopers,Olivia Wilde Alex Borstein Timothée Chalamet Jessie Nelson Comedy
2433,Bart Freundlich,Kristen Stewart,Corbin Bleu,Kevin G. Schmidt,Comedy Crime,catch that kid,Kristen Stewart Corbin Bleu Kevin G. Schmidt Bart Freundlich Comedy Crime
2434,Irwin Winkler,Ian Somerhalder,Hayden Christensen,Kristin Scott Thomas,Drama,life as a house,Ian Somerhalder Hayden Christensen Kristin Scott Thomas Irwin Winkler Drama
2435,Danny Boyle,Kate Winslet,Michael Fassbender,Michael Stuhlbarg,Biography Drama,steve jobs,Kate Winslet Michael Fassbender Michael Stuhlbarg Danny Boyle Biography Drama
2436,Chris Columbus,Alan Ruck,Marie Avgeropoulos,Shawn Roberts,Comedy Romance,"i love you, beth cooper",Alan Ruck Marie Avgeropoulos Shawn Roberts Chris Columbus Comedy Romance
2437,Miguel Arteta,Steve Buscemi,Ari Graynor,Fred Willard,Comedy Drama Romance,youth in revolt,Steve Buscemi Ari Graynor Fred Willard Miguel Arteta Comedy Drama Romance
2438,William A. Fraker,Jason Robards,Richard Farnsworth,Michael Horse,Action Adventure Western,the legend of the lone ranger,Jason Robards Richard Farnsworth Michael Horse William A. Fraker Action Adventure Western
2439,John Boorman,Daniel Radcliffe,Jamie Lee Curtis,Mark Margolis,Drama Thriller,the tailor of panama,Daniel Radcliffe Jamie Lee Curtis Mark Margolis John Boorman Drama Thriller
2440,Brian De Palma,Nancy Allen,Dennis Franz,John McMartin,Mystery Thriller,blow out,Nancy Allen Dennis Franz John McMartin Brian De Palma Mystery Thriller
2441,Courtney Solomon,Rebecca Budig,Paul Freeman,Bruce Payne,Action Crime Thriller,getaway,Rebecca Budig Paul Freeman Bruce Payne Courtney Solomon Action Crime Thriller
2442,Ang Lee,Joan Allen,Kate Burton,Henry Czerny,Drama,the ice storm,Joan Allen Kate Burton Henry Czerny Ang Lee Drama
2443,Rob Reiner,Yaya DaCosta,Annie Parisse,Frankie Valli,Comedy Drama Romance,and so it goes,Yaya DaCosta Annie Parisse Frankie Valli Rob Reiner Comedy Drama Romance
2444,Jeff Kanew,Craig T. Nelson,Shelley Long,Kellie Martin,Adventure Comedy,troop beverly hills,Craig T. Nelson Shelley Long Kellie Martin Jeff Kanew Adventure Comedy
2445,István Szabó,Miriam Margolyes,Shaun Evans,Juliet Stevenson,Comedy Drama Romance,being julia,Miriam Margolyes Shaun Evans Juliet Stevenson István Szabó Comedy Drama Romance
2446,Adrian Lyne,David Margulies,Karen Young,Kim Chan,Drama Romance,9½ weeks,David Margulies Karen Young Kim Chan Adrian Lyne Drama Romance
2447,Matthew Robbins,Ian McDiarmid,Ralph Richardson,Albert Salmi,Action Adventure Fantasy,dragonslayer,Ian McDiarmid Ralph Richardson Albert Salmi Matthew Robbins Action Adventure Fantasy
2448,Michael Hoffman,David Masterson,Kerry Condon,Anne-Marie Duff,Biography Drama Romance,the last station,David Masterson Kerry Condon Anne-Marie Duff Michael Hoffman Biography Drama Romance
2449,Tim Burton,Johnny Depp,Bill Murray,Martin Landau,Biography Comedy Drama,ed wood,Johnny Depp Bill Murray Martin Landau Tim Burton Biography Comedy Drama
2450,Jason Reitman,J.K. Simmons,Kate Winslet,Brooke Smith,Drama,labor day,J.K. Simmons Kate Winslet Brooke Smith Jason Reitman Drama
2451,Sergey Bodrov,Tadanobu Asano,Khulan Chuluun,Honglei Sun,Adventure Biography Drama History War,mongol: the rise of genghis khan,Tadanobu Asano Khulan Chuluun Honglei Sun Sergey Bodrov Adventure Biography Drama History War
2452,Guy Ritchie,Tom Hardy,Gerard Butler,Tom Wilkinson,Action Crime Thriller,rocknrolla,Tom Hardy Gerard Butler Tom Wilkinson Guy Ritchie Action Crime Thriller
2453,Hal Needham,Barry Bostwick,Michael Beck,Henry Silva,Action Sci-Fi,megaforce,Barry Bostwick Michael Beck Henry Silva Hal Needham Action Sci-Fi
2454,Kenneth Branagh,Julie Christie,Brian Blessed,Richard Briers,Drama,hamlet,Julie Christie Brian Blessed Richard Briers Kenneth Branagh Drama
2455,Bruce Beresford,Bruce Greenwood,Suzie Steen,Aden Young,Biography Drama Music Romance,mao's last dancer,Bruce Greenwood Suzie Steen Aden Young Bruce Beresford Biography Drama Music Romance
2456,Jeff Nichols,Kirsten Dunst,Sam Shepard,Paul Sparks,Adventure Drama Sci-Fi Thriller,midnight special,Kirsten Dunst Sam Shepard Paul Sparks Jeff Nichols Adventure Drama Sci-Fi Thriller
2457,Woody Allen,Woody Allen,Stockard Channing,Fisher Stevens,Comedy Romance,anything else,Woody Allen Stockard Channing Fisher Stevens Woody Allen Comedy Romance
2458,Jonathan Teplitzky,Jeremy Irvine,Colin Firth,Sam Reid,Biography Drama Romance War,the railway man,Jeremy Irvine Colin Firth Sam Reid Jonathan Teplitzky Biography Drama Romance War
2459,unknown,Poppy Montgomery,Dylan Walsh,Dallas Roberts,Drama Mystery,unforgettable            ,Poppy Montgomery Dylan Walsh Dallas Roberts unknown Drama Mystery
2460,Michael Haneke,Ulrich Tukur,Burghart Klaußner,Leonie Benesch,Drama Mystery,the white ribbon,Ulrich Tukur Burghart Klaußner Leonie Benesch Michael Haneke Drama Mystery
2461,Zack Ward,Zack Ward,Anna Harr,James Cullen Bressack,Horror,restoration,Zack Ward Anna Harr James Cullen Bressack Zack Ward Horror
2462,Mike Marvin,Clint Howard,Randy Quaid,Nick Cassavetes,Action Horror Romance Sci-Fi Thriller,the wraith,Clint Howard Randy Quaid Nick Cassavetes Mike Marvin Action Horror Romance Sci-Fi Thriller
2463,D.J. Caruso,Adam Goldberg,Meat Loaf,Anthony LaPaglia,Crime Drama Mystery Thriller,the salton sea,Adam Goldberg Meat Loaf Anthony LaPaglia D.J. Caruso Crime Drama Mystery Thriller
2464,Nimród Antal,James Hetfield,Mackenzie Gray,Lars Ulrich,Music,metallica through the never,James Hetfield Mackenzie Gray Lars Ulrich Nimród Antal Music
2465,Gregor Jordan,Austin Nichols,Brad Renfro,Lou Taylor Pucci,Crime Drama Thriller,the informers,Austin Nichols Brad Renfro Lou Taylor Pucci Gregor Jordan Crime Drama Thriller
2466,unknown,Edgar Ramírez,Nora von Waldstätten,Katharina Schüttler,Biography Crime Drama Thriller,carlos            ,Edgar Ramírez Nora von Waldstätten Katharina Schüttler unknown Biography Crime Drama Thriller
2467,Tran Anh Hung,Takuya Kimura,Simón Andreu,Shawn Yue,Thriller,i come with the rain,Takuya Kimura Simón Andreu Shawn Yue Tran Anh Hung Thriller
2468,Lance Hool,Tom Berenger,Joaquim de Almeida,Mark Moses,Action Drama History Romance War Western,one man's hero,Tom Berenger Joaquim de Almeida Mark Moses Lance Hool Action Drama History Romance War Western
2469,George A. Romero,Greg Nicotero,John Amplas,Joseph Pilato,Horror,day of the dead,Greg Nicotero John Amplas Joseph Pilato George A. Romero Horror
2470,Chuck Russell,Sam Trammell,Rebecca De Mornay,Amanda Schull,Action Crime Drama Thriller,i am wrath,Sam Trammell Rebecca De Mornay Amanda Schull Chuck Russell Action Crime Drama Thriller
2471,Christian Volckman,Romola Garai,Catherine McCormack,Kevork Malikyan,Action Animation Sci-Fi Thriller,renaissance,Romola Garai Catherine McCormack Kevork Malikyan Christian Volckman Action Animation Sci-Fi Thriller
2472,Jon Cassar,Demi Moore,Landon Liboiron,Michael Wincott,Drama Western,forsaken,Demi Moore Landon Liboiron Michael Wincott Jon Cassar Drama Western
2473,Richard Fleischer,Ernie Reyes Jr.,Brigitte Nielsen,Sandahl Bergman,Action Adventure Fantasy,red sonja,Ernie Reyes Jr. Brigitte Nielsen Sandahl Bergman Richard Fleischer Action Adventure Fantasy
2474,Rodrigo Cortés,Robert De Niro,Toby Jones,Craig Roberts,Drama Horror Mystery Thriller,red lights,Robert De Niro Toby Jones Craig Roberts Rodrigo Cortés Drama Horror Mystery Thriller
2475,Greg Mottola,Emma Stone,Joe Lo Truglio,Kevin Corrigan,Comedy,superbad,Emma Stone Joe Lo Truglio Kevin Corrigan Greg Mottola Comedy
2476,Tyler Perry,Vanessa Ferlito,Keshia Knight Pulliam,Derek Luke,Comedy Crime Drama,madea goes to jail,Vanessa Ferlito Keshia Knight Pulliam Derek Luke Tyler Perry Comedy Crime Drama
2477,David Hayter,Jason Momoa,Jennifer Hale,Stephen McHattie,Action Horror,wolves,Jason Momoa Jennifer Hale Stephen McHattie David Hayter Action Horror
2478,Jon M. Chu,Cassie Ventura,Mari Koda,Luis Rosado,Drama Music Musical Romance,step up 2: the streets,Cassie Ventura Mari Koda Luis Rosado Jon M. Chu Drama Music Musical Romance
2479,Cory Edwards,Anne Hathaway,Chazz Palminteri,Jim Belushi,Action Animation Comedy Crime Family,hoodwinked!,Anne Hathaway Chazz Palminteri Jim Belushi Cory Edwards Action Animation Comedy Crime Family
2480,Terry George,Don Cheadle,Sophie Okonedo,Hakeem Kae-Kazim,Drama History War,hotel rwanda,Don Cheadle Sophie Okonedo Hakeem Kae-Kazim Terry George Drama History War
2481,Xavier Gens,Henry Ian Cusick,Dougray Scott,Ulrich Thomsen,Action Crime Drama Thriller,hitman,Henry Ian Cusick Dougray Scott Ulrich Thomsen Xavier Gens Action Crime Drama Thriller
2482,Kasi Lemmons,Jennifer Hudson,Mary J. Blige,Vondie Curtis-Hall,Drama Family Music Musical,black nativity,Jennifer Hudson Mary J. Blige Vondie Curtis-Hall Kasi Lemmons Drama Family Music Musical
2483,Brian A Miller,Bruce Willis,50 Cent,Jessica Lowndes,Action Thriller,the prince,Bruce Willis 50 Cent Jessica Lowndes Brian A Miller Action Thriller
2484,Matt Dillon,Kirk Fox,Shawn Andrews,Rob Campbell,Crime Drama Thriller,city of ghosts,Kirk Fox Shawn Andrews Rob Campbell Matt Dillon Crime Drama Thriller
2485,Alejandro Amenábar,Fionnula Flanagan,Elaine Cassidy,Eric Sykes,Fantasy Horror Thriller,the others,Fionnula Flanagan Elaine Cassidy Eric Sykes Alejandro Amenábar Fantasy Horror Thriller
2486,James Cameron,Michael Biehn,Carrie Henn,Jenette Goldstein,Action Adventure Sci-Fi,aliens,Michael Biehn Carrie Henn Jenette Goldstein James Cameron Action Adventure Sci-Fi
2487,George Cukor,Jeremy Brett,Rex Harrison,Theodore Bikel,Drama Family Musical Romance,my fair lady,Jeremy Brett Rex Harrison Theodore Bikel George Cukor Drama Family Musical Romance
2488,Jim Gillespie,Muse Watson,Sarah Michelle Gellar,Anne Heche,Horror Mystery Thriller,i know what you did last summer,Muse Watson Sarah Michelle Gellar Anne Heche Jim Gillespie Horror Mystery Thriller
2489,Luke Greenfield,Rob Riggle,Damon Wayans Jr.,James D'Arcy,Comedy,let's be cops,Rob Riggle Damon Wayans Jr. James D'Arcy Luke Greenfield Comedy
2490,Alexander Payne,Virginia Madsen,Patrick Gallagher,M.C. Gainey,Adventure Comedy Drama Romance,sideways,Virginia Madsen Patrick Gallagher M.C. Gainey Alexander Payne Adventure Comedy Drama Romance
2491,Jay Chandrasekhar,Chris Moss,Owain Yeoman,Jay Chandrasekhar,Comedy,beerfest,Chris Moss Owain Yeoman Jay Chandrasekhar Jay Chandrasekhar Comedy
2492,John Carpenter,Jamie Lee Curtis,Donald Pleasence,P.J. Soles,Horror Thriller,halloween,Jamie Lee Curtis Donald Pleasence P.J. Soles John Carpenter Horror Thriller
2493,Yimou Zhang,Jet Li,Tony Chiu Wai Leung,Maggie Cheung,Action Adventure History,hero,Jet Li Tony Chiu Wai Leung Maggie Cheung Yimou Zhang Action Adventure History
2494,John Hoffman,Liam Aiken,Molly Shannon,Kevin Nealon,Comedy Drama Family Fantasy Sci-Fi,good boy!,Liam Aiken Molly Shannon Kevin Nealon John Hoffman Comedy Drama Family Fantasy Sci-Fi
2495,Malcolm D. Lee,Harold Perrineau,Sanaa Lathan,Eddie Cibrian,Comedy Drama,the best man holiday,Harold Perrineau Sanaa Lathan Eddie Cibrian Malcolm D. Lee Comedy Drama
2496,Joe Carnahan,Ryan Reynolds,Common,Alex Rocco,Action Crime Drama Thriller,smokin' aces,Ryan Reynolds Common Alex Rocco Joe Carnahan Action Crime Drama Thriller
2497,Kevin Greutert,Costas Mandylor,Gina Holden,Betsy Russell,Horror Mystery,saw 3d: the final chapter,Costas Mandylor Gina Holden Betsy Russell Kevin Greutert Horror Mystery
2498,Michael Lehmann,Emmanuelle Vaugier,Vinessa Shaw,Paulo Costanzo,Comedy Romance,40 days and 40 nights,Emmanuelle Vaugier Vinessa Shaw Paulo Costanzo Michael Lehmann Comedy Romance
2499,Joseph Kosinski,Jeff Bridges,Olivia Wilde,James Frain,Action Adventure Sci-Fi,tron: legacy,Jeff Bridges Olivia Wilde James Frain Joseph Kosinski Action Adventure Sci-Fi
2500,John Fortenberry,Will Ferrell,Chris Kattan,Dan Hedaya,Comedy Music Romance,a night at the roxbury,Will Ferrell Chris Kattan Dan Hedaya John Fortenberry Comedy Music Romance
2501,Daniel Barnz,Alex Pettyfer,Mary-Kate Olsen,Erik Knudsen,Drama Fantasy Romance,beastly,Alex Pettyfer Mary-Kate Olsen Erik Knudsen Daniel Barnz Drama Fantasy Romance
2502,Alexandre Aja,Dan Byrd,Greg Nicotero,Vinessa Shaw,Horror,the hills have eyes,Dan Byrd Greg Nicotero Vinessa Shaw Alexandre Aja Horror
2503,Sam Weisman,Kevin Grevioux,Jenna Boyd,Mary McCormack,Comedy,dickie roberts: former child star,Kevin Grevioux Jenna Boyd Mary McCormack Sam Weisman Comedy
2504,Niki Caro,Morgan Saylor,Valente Rodriguez,Diana Maria Riva,Biography Drama Sport,"mcfarland, usa",Morgan Saylor Valente Rodriguez Diana Maria Riva Niki Caro Biography Drama Sport
2505,Erik White,Brandon T. Jackson,Loretta Devine,Shad Moss,Comedy,lottery ticket,Brandon T. Jackson Loretta Devine Shad Moss Erik White Comedy
2506,Chris Robinson,T.I.,Adam Boyer,Malika,Comedy Crime Drama Music Romance,atl,T.I. Adam Boyer Malika Chris Robinson Comedy Crime Drama Music Romance
2507,Jason Moore,Anna Kendrick,Hana Mae Lee,Ben Platt,Comedy Music Romance,pitch perfect,Anna Kendrick Hana Mae Lee Ben Platt Jason Moore Comedy Music Romance
2508,Michael Tollin,Marc Blucas,Brian Dennehy,Bruce Davison,Comedy Drama Romance Sport,summer catch,Marc Blucas Brian Dennehy Bruce Davison Michael Tollin Comedy Drama Romance Sport
2509,Sam Raimi,Gary Cole,Bridget Fonda,Chelcie Ross,Crime Drama Thriller,a simple plan,Gary Cole Bridget Fonda Chelcie Ross Sam Raimi Crime Drama Thriller
2510,Robert Harmon,Alexander Gould,Ethan Embry,Marc Blucas,Horror Mystery Thriller,they,Alexander Gould Ethan Embry Marc Blucas Robert Harmon Horror Mystery Thriller
2511,Trent Cooper,Thomas F. Wilson,Larry the Cable Guy,Megyn Price,Comedy Romance,larry the cable guy: health inspector,Thomas F. Wilson Larry the Cable Guy Megyn Price Trent Cooper Comedy Romance
2512,Gary Halvorson,Vanessa Williams,Kevin Clash,Caroll Spinney,Adventure Comedy Family Fantasy Musical,the adventures of elmo in grouchland,Vanessa Williams Kevin Clash Caroll Spinney Gary Halvorson Adventure Comedy Family Fantasy Musical
2513,Antoine Fuqua,Don Cheadle,Lili Taylor,Armando Riesco,Crime Drama Thriller,brooklyn's finest,Don Cheadle Lili Taylor Armando Riesco Antoine Fuqua Crime Drama Thriller
2514,Nicholas Ray,Ava Gardner,David Niven,John Ireland,Action Adventure Drama History War,55 days at peking,Ava Gardner David Niven John Ireland Nicholas Ray Action Adventure Drama History War
2515,Fede Alvarez,Lou Taylor Pucci,Elizabeth Blackmore,Ellen Sandweiss,Horror,evil dead,Lou Taylor Pucci Elizabeth Blackmore Ellen Sandweiss Fede Alvarez Horror
2516,Donald Petrie,Nia Vardalos,Harland Williams,Rachel Dratch,Comedy Romance,my life in ruins,Nia Vardalos Harland Williams Rachel Dratch Donald Petrie Comedy Romance
2517,Paul Weitz,Judy Greer,Dennis Quaid,Chris Klein,Comedy Music,american dreamz,Judy Greer Dennis Quaid Chris Klein Paul Weitz Comedy Music
2518,Sidney J. Furie,Jim Broadbent,Margot Kidder,William Hootkins,Action Adventure Family Sci-Fi,superman iv: the quest for peace,Jim Broadbent Margot Kidder William Hootkins Sidney J. Furie Action Adventure Family Sci-Fi
2519,Ian Iqbal Rashid,DeRay Davis,Clé Bennett,Conrad Coates,Drama,how she move,DeRay Davis Clé Bennett Conrad Coates Ian Iqbal Rashid Drama
2520,Wayne Kramer,Paul Walker,Chazz Palminteri,Ivana Milicevic,Action Crime Drama Thriller,running scared,Paul Walker Chazz Palminteri Ivana Milicevic Wayne Kramer Action Crime Drama Thriller
2521,Rowdy Herrington,Aidan Quinn,Jeremy Northam,Paul Freeman,Biography Drama Romance Sport,bobby jones: stroke of genius,Aidan Quinn Jeremy Northam Paul Freeman Rowdy Herrington Biography Drama Romance Sport
2522,Jim Goddard,Victor Wong,Paul Freeman,Clyde Kusatsu,Adventure Crime Drama Romance,shanghai surprise,Victor Wong Paul Freeman Clyde Kusatsu Jim Goddard Adventure Crime Drama Romance
2523,Neil Burger,Rufus Sewell,Eddie Marsan,Jake Wood,Drama Mystery Romance Thriller,the illusionist,Rufus Sewell Eddie Marsan Jake Wood Neil Burger Drama Mystery Romance Thriller
2524,Noel Marshall,Tippi Hedren,Melanie Griffith,Zakes Mokae,Adventure Horror Thriller,roar,Tippi Hedren Melanie Griffith Zakes Mokae Noel Marshall Adventure Horror Thriller
2525,Joel Schumacher,Brenda Fricker,David Murray,Gerard McSorley,Biography Crime Drama Thriller,veronica guerin,Brenda Fricker David Murray Gerard McSorley Joel Schumacher Biography Crime Drama Thriller
2526,Andrea Di Stefano,Josh Hutcherson,Brady Corbet,Carlos Bardem,Crime Drama Romance Thriller,escobar: paradise lost,Josh Hutcherson Brady Corbet Carlos Bardem Andrea Di Stefano Crime Drama Romance Thriller
2527,Richard Kelly,Janeane Garofalo,Curtis Armstrong,Chris Andrew Ciulla,Comedy Mystery Sci-Fi Thriller,southland tales,Janeane Garofalo Curtis Armstrong Chris Andrew Ciulla Richard Kelly Comedy Mystery Sci-Fi Thriller
2528,Guillaume Ivernel,Rob Paulsen,Jess Harnell,Mary Mouser,Adventure Animation Family Fantasy,dragon hunters,Rob Paulsen Jess Harnell Mary Mouser Guillaume Ivernel Adventure Animation Family Fantasy
2529,Jack Smight,George Peppard,Jan-Michael Vincent,Paul Winfield,Sci-Fi,damnation alley,George Peppard Jan-Michael Vincent Paul Winfield Jack Smight Sci-Fi
2530,Todd Lincoln,Julianna Guill,Rick Gomez,Tim Williams,Horror Thriller,the apparition,Julianna Guill Rick Gomez Tim Williams Todd Lincoln Horror Thriller
2531,Howard Zieff,Macaulay Culkin,Jamie Lee Curtis,Griffin Dunne,Comedy Drama Family Romance,my girl,Macaulay Culkin Jamie Lee Curtis Griffin Dunne Howard Zieff Comedy Drama Family Romance
2532,Steven Shainberg,Robert Downey Jr.,Ty Burrell,Matt Servitto,Biography Drama Romance,fur: an imaginary portrait of diane arbus,Robert Downey Jr. Ty Burrell Matt Servitto Steven Shainberg Biography Drama Romance
2533,Neil Burger,Rufus Sewell,Eddie Marsan,Jake Wood,Drama Mystery Romance Thriller,the illusionist,Rufus Sewell Eddie Marsan Jake Wood Neil Burger Drama Mystery Romance Thriller
2534,Oliver Stone,Hal Holbrook,Tamara Tunie,James Karen,Crime Drama,wall street,Hal Holbrook Tamara Tunie James Karen Oliver Stone Crime Drama
2535,Ang Lee,Alan Rickman,Kate Winslet,Tom Wilkinson,Drama Romance,sense and sensibility,Alan Rickman Kate Winslet Tom Wilkinson Ang Lee Drama Romance
2536,Julian Jarrold,Anne Hathaway,Julie Walters,Laurence Fox,Biography Drama Romance,becoming jane,Anne Hathaway Julie Walters Laurence Fox Julian Jarrold Biography Drama Romance
2537,Joe Nussbaum,Danny Strong,Matt Long,Samm Levine,Comedy Romance,sydney white,Danny Strong Matt Long Samm Levine Joe Nussbaum Comedy Romance
2538,Vadim Perelman,Frances Fisher,Kim Dickens,Ron Eldard,Drama,house of sand and fog,Frances Fisher Kim Dickens Ron Eldard Vadim Perelman Drama
2539,Peter Weir,Robin Williams,Josh Charles,Kurtwood Smith,Comedy Drama,dead poets society,Robin Williams Josh Charles Kurtwood Smith Peter Weir Comedy Drama
2540,Peter Farrelly,Lauren Holly,Mike Starr,Teri Garr,Comedy,dumb & dumber,Lauren Holly Mike Starr Teri Garr Peter Farrelly Comedy
2541,Rob Reiner,Bruno Kirby,Gretchen Palmer,Harley Jane Kozak,Comedy Drama Romance,when harry met sally...,Bruno Kirby Gretchen Palmer Harley Jane Kozak Rob Reiner Comedy Drama Romance
2542,Sidney Lumet,Charlotte Rampling,James Mason,Jack Warden,Drama,the verdict,Charlotte Rampling James Mason Jack Warden Sidney Lumet Drama
