,director_name,actor_1_name,actor_2_name,actor_3_name,genres,movie_title,comb
1101,Garth Jennings,Zooey Deschanel,Kelly Macdonald,Thomas Lennon,Adventure Comedy Sci-Fi,the hitchhiker's guide to the galaxy,Zooey Deschanel Kelly Macdonald Thomas Lennon Garth Jennings Adventure Comedy Sci-Fi
1102,Joel Zwick,Dania Ramirez,Nick Zano,Alice Greczyn,Comedy Family Fantasy Romance,fat albert,Dania Ramirez Nick Zano Alice Greczyn Joel Zwick Comedy Family Fantasy Romance
1103,Russell Mulcahy,Milla Jovovich,Mike Epps,James Tumminia,Action Horror Sci-Fi Thriller,resident evil: extinction,Milla Jovovich Mike Epps James Tumminia Russell Mulcahy Action Horror Sci-Fi Thriller
1104,Frank Coraci,Bella Thorne,Adam Sandler,Joel McHale,Comedy Romance,blended,Bella Thorne Adam Sandler Joel McHale Frank Coraci Comedy Romance
1105,Wayne Wang,LL Cool J,Alicia Witt,Timothy Hutton,Adventure Comedy Drama,last holiday,LL Cool J Alicia Witt Timothy Hutton Wayne Wang Adventure Comedy Drama
1106,Curtis Hanson,Meryl Streep,Glenn Morshower,William Lucking,Action Adventure Crime Thriller,the river wild,Meryl Streep Glenn Morshower William Lucking Curtis Hanson Action Adventure Crime Thriller
1107,Frank Oz,Steve Coogan,Vincent Kartheiser,David Keith,Drama Family Fantasy,the indian in the cupboard,Steve Coogan Vincent Kartheiser David Keith Frank Oz Drama Family Fantasy
1108,Oliver Stone,Demián Bichir,Shea Whigham,Gary Stretch,Crime Drama Thriller,savages,Demián Bichir Shea Whigham Gary Stretch Oliver Stone Crime Drama Thriller
1109,David R. Ellis,Richard Burgi,Valerie Cruz,Will Beinbrink,Action Crime Thriller,cellular,Richard Burgi Valerie Cruz Will Beinbrink David R. Ellis Action Crime Thriller
1110,Peter Howitt,Kevin McNally,Natalie Imbruglia,Ben Miller,Action Adventure Comedy,johnny english,Kevin McNally Natalie Imbruglia Ben Miller Peter Howitt Action Adventure Comedy
1111,John A. Davis,Nicolas Cage,Meryl Streep,Julia Roberts,Adventure Animation Comedy Family Fantasy,the ant bully,Nicolas Cage Meryl Streep Julia Roberts John A. Davis Adventure Animation Comedy Family Fantasy
1112,David Lynch,Virginia Madsen,Jürgen Prochnow,José Ferrer,Action Adventure Sci-Fi,dune,Virginia Madsen Jürgen Prochnow José Ferrer David Lynch Action Adventure Sci-Fi
1113,Julie Taymor,Jim Sturgess,T.V. Carpio,Robert Clohessy,Drama Fantasy Musical Romance,across the universe,Jim Sturgess T.V. Carpio Robert Clohessy Julie Taymor Drama Fantasy Musical Romance
1114,Sam Mendes,Leonardo DiCaprio,Kate Winslet,Joe Komara,Drama Romance,revolutionary road,Leonardo DiCaprio Kate Winslet Joe Komara Sam Mendes Drama Romance
1115,Richard Donner,Bruce Willis,David Zayas,Sasha Roiz,Action Crime Drama Thriller,16 blocks,Bruce Willis David Zayas Sasha Roiz Richard Donner Action Crime Drama Thriller
1116,Mathieu Kassovitz,Vin Diesel,Charlotte Rampling,David Belle,Action Adventure Sci-Fi Thriller,babylon a.d.,Vin Diesel Charlotte Rampling David Belle Mathieu Kassovitz Action Adventure Sci-Fi Thriller
1117,John Gray,Alexa PenaVega,Bob Gunton,Keenen Ivory Wayans,Action Comedy Crime Drama Thriller,the glimmer man,Alexa PenaVega Bob Gunton Keenen Ivory Wayans John Gray Action Comedy Crime Drama Thriller
1118,Harold Ramis,John de Lancie,Brian Doyle-Murray,Obba Babatundé,Comedy Romance Sci-Fi,multiplicity,John de Lancie Brian Doyle-Murray Obba Babatundé Harold Ramis Comedy Romance Sci-Fi
1119,John Schultz,Malese Jow,Carter Jenkins,Tim Meadows,Adventure Comedy Family Fantasy Sci-Fi,aliens in the attic,Malese Jow Carter Jenkins Tim Meadows John Schultz Adventure Comedy Family Fantasy Sci-Fi
1120,Sean Penn,Costas Mandylor,Adrien Dorval,Nels Lennarson,Crime Drama Mystery Thriller,the pledge,Costas Mandylor Adrien Dorval Nels Lennarson Sean Penn Crime Drama Mystery Thriller
1121,Susan Stroman,Jon Lovitz,Will Ferrell,Matthew Broderick,Comedy Musical,the producers,Jon Lovitz Will Ferrell Matthew Broderick Susan Stroman Comedy Musical
1122,Pete Travis,Wood Harris,Jason Cope,Rakie Ayola,Action Sci-Fi,dredd,Wood Harris Jason Cope Rakie Ayola Pete Travis Action Sci-Fi
1123,Simon Wincer,Cary-Hiroyuki Tagawa,Treat Williams,Kristy Swanson,Action Adventure Comedy Fantasy,the phantom,Cary-Hiroyuki Tagawa Treat Williams Kristy Swanson Simon Wincer Action Adventure Comedy Fantasy
1124,Billy Bob Thornton,Matt Damon,Henry Thomas,Sam Shepard,Drama Romance Western,all the pretty horses,Matt Damon Henry Thomas Sam Shepard Billy Bob Thornton Drama Romance Western
1125,Oliver Stone,Anthony Hopkins,Bob Hoskins,Joan Allen,Biography Drama History,nixon,Anthony Hopkins Bob Hoskins Joan Allen Oliver Stone Biography Drama History
1126,Roman Polanski,Jim Belushi,Olivia Williams,Timothy Hutton,Mystery Thriller,the ghost writer,Jim Belushi Olivia Williams Timothy Hutton Roman Polanski Mystery Thriller
1127,Stephen Sommers,Djimon Hounsou,Jason Flemyng,Wes Studi,Action Adventure Horror Sci-Fi,deep rising,Djimon Hounsou Jason Flemyng Wes Studi Stephen Sommers Action Adventure Horror Sci-Fi
1128,Spike Lee,Joseph Gordon-Levitt,Omari Hardwick,Laz Alonso,Action Crime Drama Thriller War,miracle at st. anna,Joseph Gordon-Levitt Omari Hardwick Laz Alonso Spike Lee Action Crime Drama Thriller War
1129,Yimou Zhang,Li Gong,Ye Liu,Man Li,Drama Romance,curse of the golden flower,Li Gong Ye Liu Man Li Yimou Zhang Drama Romance
1130,Danny Pang,Nicolas Cage,Charlie Yeung,James With,Action Crime Thriller,bangkok dangerous,Nicolas Cage Charlie Yeung James With Danny Pang Action Crime Thriller
1131,Barry Sonnenfeld,Zooey Deschanel,Janeane Garofalo,Omar Epps,Comedy Crime Thriller,big trouble,Zooey Deschanel Janeane Garofalo Omar Epps Barry Sonnenfeld Comedy Crime Thriller
1132,Mike Newell,Marcela Mar,Giovanna Mezzogiorno,Unax Ugalde,Drama Romance,love in the time of cholera,Marcela Mar Giovanna Mezzogiorno Unax Ugalde Mike Newell Drama Romance
1133,unknown,Pierre Perrier,Clotilde Hesme,Céline Sallette,Drama Fantasy Horror Mystery,the returned            ,Pierre Perrier Clotilde Hesme Céline Sallette unknown Drama Fantasy Horror Mystery
1134,George P. Cosmatos,Sam Waterston,Ben Gazzara,Nicholas Turturro,Action Thriller,shadow conspiracy,Sam Waterston Ben Gazzara Nicholas Turturro George P. Cosmatos Action Thriller
1135,Oliver Parker,Daniel Kaluuya,Tim McInnerny,Togo Igawa,Action Adventure Comedy Crime,johnny english reborn,Daniel Kaluuya Tim McInnerny Togo Igawa Oliver Parker Action Adventure Comedy Crime
1136,Lawrence Kasanoff,Jerry Stiller,Larry Miller,Harvey Fierstein,Action Animation Comedy Family Fantasy,foodfight!,Jerry Stiller Larry Miller Harvey Fierstein Lawrence Kasanoff Action Animation Comedy Family Fantasy
1137,Ben Affleck,Clea DuVall,Scoot McNairy,Tate Donovan,Biography Drama History Thriller,argo,Clea DuVall Scoot McNairy Tate Donovan Ben Affleck Biography Drama History Thriller
1138,Andrew Davis,Harrison Ford,Daniel Roebuck,Sela Ward,Action Adventure Crime Drama Mystery Thriller,the fugitive,Harrison Ford Daniel Roebuck Sela Ward Andrew Davis Action Adventure Crime Drama Mystery Thriller
1139,Andy Tennant,Gerard Butler,Dorian Missick,Peter Greene,Action Comedy Romance,the bounty hunter,Gerard Butler Dorian Missick Peter Greene Andy Tennant Action Comedy Romance
1140,Barry Levinson,Robert De Niro,Brad Pitt,Minnie Driver,Crime Drama Thriller,sleepers,Robert De Niro Brad Pitt Minnie Driver Barry Levinson Crime Drama Thriller
1141,George P. Cosmatos,Sylvester Stallone,Julia Nickson,Martin Kove,Action Adventure Thriller War,rambo: first blood part ii,Sylvester Stallone Julia Nickson Martin Kove George P. Cosmatos Action Adventure Thriller War
1142,Brian Gibson,Joseph Gordon-Levitt,Demi Moore,Anne Heche,Drama Thriller,the juror,Joseph Gordon-Levitt Demi Moore Anne Heche Brian Gibson Drama Thriller
1143,Norman Ferguson,Mel Blanc,Dickie Jones,Cliff Edwards,Animation Family Fantasy Musical,pinocchio,Mel Blanc Dickie Jones Cliff Edwards Norman Ferguson Animation Family Fantasy Musical
1144,Michael Cimino,Jeff Bridges,Sam Waterston,Isabelle Huppert,Adventure Drama Western,heaven's gate,Jeff Bridges Sam Waterston Isabelle Huppert Michael Cimino Adventure Drama Western
1145,Len Wiseman,Sophia Myles,Tony Curran,Derek Jacobi,Action Adventure Fantasy Sci-Fi Thriller,underworld: evolution,Sophia Myles Tony Curran Derek Jacobi Len Wiseman Action Adventure Fantasy Sci-Fi Thriller
1146,Paul McGuigan,Daniel Radcliffe,Spencer Wilding,Daniel Mays,Drama Horror Sci-Fi Thriller,victor frankenstein,Daniel Radcliffe Spencer Wilding Daniel Mays Paul McGuigan Drama Horror Sci-Fi Thriller
1147,Gus Van Sant,F. Murray Abraham,Rob Brown,Michael Nouri,Drama,finding forrester,F. Murray Abraham Rob Brown Michael Nouri Gus Van Sant Drama
1148,Betty Thomas,Steve Buscemi,Viggo Mortensen,Elizabeth Perkins,Comedy Drama,28 days,Steve Buscemi Viggo Mortensen Elizabeth Perkins Betty Thomas Comedy Drama
1149,Louis Leterrier,Morgan Freeman,Jet Li,Bob Hoskins,Action Crime Drama Thriller,unleashed,Morgan Freeman Jet Li Bob Hoskins Louis Leterrier Action Crime Drama Thriller
1150,Roger Kumble,Judith Chapman,Lillian Adams,Chelsea Bond,Comedy Romance,the sweetest thing,Judith Chapman Lillian Adams Chelsea Bond Roger Kumble Comedy Romance
1151,Sydney Pollack,Tom Cruise,Holly Hunter,Wilford Brimley,Drama Mystery Thriller,the firm,Tom Cruise Holly Hunter Wilford Brimley Sydney Pollack Drama Mystery Thriller
1152,Burr Steers,Augustus Prew,Charlie Tahan,Valerie Tian,Drama Fantasy Romance,charlie st. cloud,Augustus Prew Charlie Tahan Valerie Tian Burr Steers Drama Fantasy Romance
1153,Simon West,Jason Statham,Tony Goldwyn,Mini Anden,Action Crime Thriller,the mechanic,Jason Statham Tony Goldwyn Mini Anden Simon West Action Crime Thriller
1154,Phil Lord,Channing Tatum,Dax Flame,Rob Riggle,Action Comedy Crime,21 jump street,Channing Tatum Dax Flame Rob Riggle Phil Lord Action Comedy Crime
1155,Roger Michell,Julia Roberts,Clarke Peters,Dylan Moran,Comedy Drama Romance,notting hill,Julia Roberts Clarke Peters Dylan Moran Roger Michell Comedy Drama Romance
1156,Peter Lord,Imelda Staunton,Miranda Richardson,Julia Sawalha,Adventure Animation Comedy Drama Family,chicken run,Imelda Staunton Miranda Richardson Julia Sawalha Peter Lord Adventure Animation Comedy Drama Family
1157,John Hamburg,Philip Seymour Hoffman,Masi Oka,Debra Messing,Comedy Romance,along came polly,Philip Seymour Hoffman Masi Oka Debra Messing John Hamburg Comedy Romance
1158,Reginald Hudlin,John Witherspoon,Eartha Kitt,Geoffrey Holder,Comedy Drama Romance,boomerang,John Witherspoon Eartha Kitt Geoffrey Holder Reginald Hudlin Comedy Drama Romance
1159,Paul Feig,Michael Rapaport,William Xifaras,Demián Bichir,Action Comedy Crime,the heat,Michael Rapaport William Xifaras Demián Bichir Paul Feig Action Comedy Crime
1160,Joseph L. Mankiewicz,Martin Landau,Richard Burton,Roddy McDowall,Biography Drama History Romance,cleopatra,Martin Landau Richard Burton Roddy McDowall Joseph L. Mankiewicz Biography Drama History Romance
1161,Frank Coraci,Salma Hayek,Reggie Lee,Charice,Action Comedy Sport,here comes the boom,Salma Hayek Reggie Lee Charice Frank Coraci Action Comedy Sport
1162,Carl Franklin,Morgan Freeman,Adam Scott,Bruce Davison,Crime Drama Mystery Thriller,high crimes,Morgan Freeman Adam Scott Bruce Davison Carl Franklin Crime Drama Mystery Thriller
1163,Barbra Streisand,Jeff Bridges,Austin Pendleton,Mimi Rogers,Comedy Drama Romance,the mirror has two faces,Jeff Bridges Austin Pendleton Mimi Rogers Barbra Streisand Comedy Drama Romance
1164,Mark Pellington,Debra Messing,Will Patton,David Eigenberg,Drama Horror Mystery Thriller,the mothman prophecies,Debra Messing Will Patton David Eigenberg Mark Pellington Drama Horror Mystery Thriller
1165,Larry Charles,Bono,Elton John,Slash,Comedy,brüno,Bono Elton John Slash Larry Charles Comedy
1166,John Glen,Robert Davi,Talisa Soto,Anthony Zerbe,Action Adventure Thriller,licence to kill,Robert Davi Talisa Soto Anthony Zerbe John Glen Action Adventure Thriller
1167,Catherine Hardwicke,Gary Oldman,Billy Burke,Virginia Madsen,Fantasy Horror Mystery Thriller,red riding hood,Gary Oldman Billy Burke Virginia Madsen Catherine Hardwicke Fantasy Horror Mystery Thriller
1168,John Herzfeld,Robert De Niro,Charlize Theron,Kelsey Grammer,Action Crime Drama Thriller,15 minutes,Robert De Niro Charlize Theron Kelsey Grammer John Herzfeld Action Crime Drama Thriller
1169,Annabel Jankel,Bob Hoskins,Fisher Stevens,Fiona Shaw,Adventure Comedy Family Fantasy Sci-Fi,super mario bros.,Bob Hoskins Fisher Stevens Fiona Shaw Annabel Jankel Adventure Comedy Family Fantasy Sci-Fi
1170,Andrew Niccol,Nicolas Cage,Jeremy Crutchley,Jared Burke,Crime Drama Thriller,lord of war,Nicolas Cage Jeremy Crutchley Jared Burke Andrew Niccol Crime Drama Thriller
1171,Yimou Zhang,Jet Li,Tony Chiu Wai Leung,Maggie Cheung,Action Adventure History,hero,Jet Li Tony Chiu Wai Leung Maggie Cheung Yimou Zhang Action Adventure History
1172,Julie Anne Robinson,Fisher Stevens,Debbie Reynolds,Patrick Fischler,Action Comedy Crime Romance Thriller,one for the money,Fisher Stevens Debbie Reynolds Patrick Fischler Julie Anne Robinson Action Comedy Crime Romance Thriller
1173,Evan Goldberg,James Franco,Randall Park,Anders Holm,Comedy,the interview,James Franco Randall Park Anders Holm Evan Goldberg Comedy
1174,Sngmoo Lee,Tony Cox,Dong-gun Jang,Jed Brophy,Action Fantasy Western,the warrior's way,Tony Cox Dong-gun Jang Jed Brophy Sngmoo Lee Action Fantasy Western
1175,unknown,Tim Conway,Gavin MacLeod,Bob Hastings,Comedy War,mchale's navy            ,Tim Conway Gavin MacLeod Bob Hastings unknown Comedy War
1176,Jean-Pierre Jeunet,Omar Sy,Dany Boon,André Dussollier,Action Comedy Crime,micmacs,Omar Sy Dany Boon André Dussollier Jean-Pierre Jeunet Action Comedy Crime
1177,Curtis Hanson,Mekhi Phifer,Omar Benson Miller,Evan Jones,Drama Music,8 mile,Mekhi Phifer Omar Benson Miller Evan Jones Curtis Hanson Drama Music
1178,Jamel Debbouze,Jamel Debbouze,Youssef Hajdi,Mélissa Theuriau,Adventure Animation Comedy Family,animal kingdom: let's go ape,Jamel Debbouze Youssef Hajdi Mélissa Theuriau Jamel Debbouze Adventure Animation Comedy Family
1179,Brian Helgeland,Heath Ledger,Rufus Sewell,Bérénice Bejo,Action Adventure Romance,a knight's tale,Heath Ledger Rufus Sewell Bérénice Bejo Brian Helgeland Action Adventure Romance
1180,Gordon Chan,Julian Sands,Lee Evans,Anthony Chau-Sang Wong,Action Comedy Fantasy,the medallion,Julian Sands Lee Evans Anthony Chau-Sang Wong Gordon Chan Action Comedy Fantasy
1181,M. Night Shyamalan,Bruce Willis,Haley Joel Osment,Olivia Williams,Drama Mystery Thriller,the sixth sense,Bruce Willis Haley Joel Osment Olivia Williams M. Night Shyamalan Drama Mystery Thriller
1182,Asger Leth,Robert Clohessy,Mandy Gonzalez,J. Smith-Cameron,Action Crime Thriller,man on a ledge,Robert Clohessy Mandy Gonzalez J. Smith-Cameron Asger Leth Action Crime Thriller
1183,David Frankel,Joel McHale,Kevin Pollak,JoBeth Williams,Comedy,the big year,Joel McHale Kevin Pollak JoBeth Williams David Frankel Comedy
1184,John G. Avildsen,Martin Kove,William Zabka,William Bassett,Action Drama Family Sport,the karate kid,Martin Kove William Zabka William Bassett John G. Avildsen Action Drama Family Sport
1185,David O. Russell,Jennifer Lawrence,Christian Bale,Bradley Cooper,Crime Drama,american hustle,Jennifer Lawrence Christian Bale Bradley Cooper David O. Russell Crime Drama
1186,Anne Fletcher,Ryan Reynolds,Denis O'Hare,Craig T. Nelson,Comedy Drama Romance,the proposal,Ryan Reynolds Denis O'Hare Craig T. Nelson Anne Fletcher Comedy Drama Romance
1187,Bruce Beresford,Bruce Greenwood,Annabeth Gish,Bruce Campbell,Crime Mystery Thriller,double jeopardy,Bruce Greenwood Annabeth Gish Bruce Campbell Bruce Beresford Crime Mystery Thriller
1188,Robert Zemeckis,Lea Thompson,Jeffrey Weissman,Thomas F. Wilson,Adventure Comedy Sci-Fi,back to the future part ii,Lea Thompson Jeffrey Weissman Thomas F. Wilson Robert Zemeckis Adventure Comedy Sci-Fi
1189,Luc Besson,Scarlett Johansson,Morgan Freeman,Amr Waked,Action Sci-Fi Thriller,lucy,Scarlett Johansson Morgan Freeman Amr Waked Luc Besson Action Sci-Fi Thriller
1190,Sam Taylor-Johnson,Jennifer Ehle,Luke Grimes,Callum Rennie,Drama Romance,fifty shades of grey,Jennifer Ehle Luke Grimes Callum Rennie Sam Taylor-Johnson Drama Romance
1191,Robert Rodriguez,Sylvester Stallone,Salma Hayek,Alexa PenaVega,Action Adventure Comedy Family Sci-Fi,spy kids 3-d: game over,Sylvester Stallone Salma Hayek Alexa PenaVega Robert Rodriguez Action Adventure Comedy Family Sci-Fi
1192,Joel Schumacher,Kevin Spacey,Matthew McConaughey,Oliver Platt,Crime Drama Thriller,a time to kill,Kevin Spacey Matthew McConaughey Oliver Platt Joel Schumacher Crime Drama Thriller
1193,Shawn Levy,Tom Welling,Alyson Stoner,Bonnie Hunt,Comedy Family,cheaper by the dozen,Tom Welling Alyson Stoner Bonnie Hunt Shawn Levy Comedy Family
1194,Peter Berg,Jerry Ferrara,Scott Elrod,Dan Bilzerian,Action Biography Drama Thriller War,lone survivor,Jerry Ferrara Scott Elrod Dan Bilzerian Peter Berg Action Biography Drama Thriller War
1195,Penny Marshall,Tom Hanks,Lori Petty,Rosie O'Donnell,Comedy Drama Sport,a league of their own,Tom Hanks Lori Petty Rosie O'Donnell Penny Marshall Comedy Drama Sport
1196,James Wan,Javier Botet,Frances O'Connor,Robin Atkin Downes,Horror Mystery Thriller,the conjuring 2,Javier Botet Frances O'Connor Robin Atkin Downes James Wan Horror Mystery Thriller
1197,David Fincher,Andrew Garfield,Dustin Fitzsimons,Marcella Lentz-Pope,Biography Drama,the social network,Andrew Garfield Dustin Fitzsimons Marcella Lentz-Pope David Fincher Biography Drama
1198,Ken Kwapis,Carmen Perez,Sabrina Revelle,Sachiko Ishida,Comedy Drama Romance,he's just not that into you,Carmen Perez Sabrina Revelle Sachiko Ishida Ken Kwapis Comedy Drama Romance
1199,David Zucker,Beau Mirchoff,Carmen Electra,Regina Hall,Comedy,scary movie 4,Beau Mirchoff Carmen Electra Regina Hall David Zucker Comedy
1200,Wes Craven,Kelly Rutherford,Roger Jackson,Nancy O'Dell,Horror Mystery,scream 3,Kelly Rutherford Roger Jackson Nancy O'Dell Wes Craven Horror Mystery
1201,Robert Zemeckis,Lea Thompson,Jeffrey Weissman,Thomas F. Wilson,Adventure Comedy Sci-Fi Western,back to the future part iii,Lea Thompson Jeffrey Weissman Thomas F. Wilson Robert Zemeckis Adventure Comedy Sci-Fi Western
1202,Etan Cohen,Will Ferrell,Alison Brie,Craig T. Nelson,Comedy Crime,get hard,Will Ferrell Alison Brie Craig T. Nelson Etan Cohen Comedy Crime
1203,Francis Ford Coppola,Keanu Reeves,Anthony Hopkins,Gary Oldman,Fantasy Horror Romance,bram stoker's dracula,Keanu Reeves Anthony Hopkins Gary Oldman Francis Ford Coppola Fantasy Horror Romance
1204,Nora Ephron,Meryl Streep,Mary Lynn Rajskub,Vanessa Ferlito,Biography Drama Romance,julie & julia,Meryl Streep Mary Lynn Rajskub Vanessa Ferlito Nora Ephron Biography Drama Romance
1205,Brian Helgeland,Harrison Ford,Christopher Meloni,Nicole Beharie,Biography Drama Sport,42,Harrison Ford Christopher Meloni Nicole Beharie Brian Helgeland Biography Drama Sport
1206,Anthony Minghella,Philip Seymour Hoffman,Matt Damon,Jack Davenport,Crime Drama Thriller,the talented mr. ripley,Philip Seymour Hoffman Matt Damon Jack Davenport Anthony Minghella Crime Drama Thriller
1207,Bobby Farrelly,Bill Murray,Kathleen Turner,Rob Riggle,Comedy,dumb and dumber to,Bill Murray Kathleen Turner Rob Riggle Bobby Farrelly Comedy
1208,Frank Marshall,Paul Walker,Bruce Greenwood,Wendy Crewson,Adventure Drama Family,eight below,Paul Walker Bruce Greenwood Wendy Crewson Frank Marshall Adventure Drama Family
1209,Nancy Meyers,Robert De Niro,Anne Hathaway,Rene Russo,Comedy Drama,the intern,Robert De Niro Anne Hathaway Rene Russo Nancy Meyers Comedy Drama
1210,Tim Story,Olivia Munn,Nadine Velazquez,Bruce McGill,Action Comedy,ride along 2,Olivia Munn Nadine Velazquez Bruce McGill Tim Story Action Comedy
1211,Michael Mann,Wes Studi,Terry Kinney,Eric Schweig,Action Adventure Drama Romance War,the last of the mohicans,Wes Studi Terry Kinney Eric Schweig Michael Mann Action Adventure Drama Romance War
1212,Taylor Hackford,Bokeem Woodbine,Curtis Armstrong,Harry Lennix,Biography Drama Music,ray,Bokeem Woodbine Curtis Armstrong Harry Lennix Taylor Hackford Biography Drama Music
1213,Frank Miller,Rosario Dawson,Powers Boothe,Jason Douglas,Crime Thriller,sin city,Rosario Dawson Powers Boothe Jason Douglas Frank Miller Crime Thriller
1214,Pete Travis,Dennis Quaid,Edgar Ramírez,William Hurt,Crime Drama Mystery Thriller,vantage point,Dennis Quaid Edgar Ramírez William Hurt Pete Travis Crime Drama Mystery Thriller
1215,John Hamburg,J.K. Simmons,Jon Favreau,Jane Curtin,Comedy Romance,"i love you, man",J.K. Simmons Jon Favreau Jane Curtin John Hamburg Comedy Romance
1216,Bobby Farrelly,Jason Alexander,Bruce McGill,Susan Ward,Comedy Drama Fantasy Romance,shallow hal,Jason Alexander Bruce McGill Susan Ward Bobby Farrelly Comedy Drama Fantasy Romance
1217,Oliver Stone,Sally Kirkland,Jay O. Sanders,Cheryl Penland,Drama History Thriller,jfk,Sally Kirkland Jay O. Sanders Cheryl Penland Oliver Stone Drama History Thriller
1218,John Whitesell,Chloë Grace Moretz,Nia Long,Marisol Nichols,Comedy Crime,big momma's house 2,Chloë Grace Moretz Nia Long Marisol Nichols John Whitesell Comedy Crime
1219,Gore Verbinski,J.K. Simmons,Brad Pitt,Julia Roberts,Adventure Comedy Crime Romance,the mexican,J.K. Simmons Brad Pitt Julia Roberts Gore Verbinski Adventure Comedy Crime Romance
1220,Angelina Jolie Pitt,Finn Wittrock,Jack O'Connell,Alex Russell,Biography Drama Sport War,unbroken,Finn Wittrock Jack O'Connell Alex Russell Angelina Jolie Pitt Biography Drama Sport War
1221,Burr Steers,Matthew Perry,Hunter Parrish,Thomas Lennon,Comedy Drama Family Fantasy Romance,17 again,Matthew Perry Hunter Parrish Thomas Lennon Burr Steers Comedy Drama Family Fantasy Romance
1222,Nick Cassavetes,Don Johnson,Kate Upton,David Thornton,Comedy Romance,the other woman,Don Johnson Kate Upton David Thornton Nick Cassavetes Comedy Romance
1223,David R. Ellis,Krista Allen,Andrew Fiscella,Shantel VanSanten,Horror,the final destination,Krista Allen Andrew Fiscella Shantel VanSanten David R. Ellis Horror
1224,Steven Spielberg,Tom Hanks,Mark Rylance,Amy Ryan,Drama History Thriller,bridge of spies,Tom Hanks Mark Rylance Amy Ryan Steven Spielberg Drama History Thriller
1225,John Moore,Joaquim de Almeida,David Keith,Sam Jaeger,Action Drama Thriller War,behind enemy lines,Joaquim de Almeida David Keith Sam Jaeger John Moore Action Drama Thriller War
1226,Nicholas Stoller,Pink,Mario Lopez,Lino Facioli,Comedy Music,get him to the greek,Pink Mario Lopez Lino Facioli Nicholas Stoller Comedy Music
1227,Peter Chelsom,Lisa Ann Walter,Nick Cannon,Omar Benson Miller,Comedy Drama Romance,shall we dance,Lisa Ann Walter Nick Cannon Omar Benson Miller Peter Chelsom Comedy Drama Romance
1228,Joe Dante,Kirsten Dunst,Denis Leary,Robert Picardo,Action Adventure Comedy Family Sci-Fi,small soldiers,Kirsten Dunst Denis Leary Robert Picardo Joe Dante Action Adventure Comedy Family Sci-Fi
1229,Mark A.Z. Dippé,Michael Jai White,Frank Welker,Miko Hughes,Action Horror,spawn,Michael Jai White Frank Welker Miko Hughes Mark A.Z. Dippé Action Horror
1230,Kevin Reynolds,Henry Cavill,James Frain,Michael Wincott,Action Adventure Drama Romance Thriller,the count of monte cristo,Henry Cavill James Frain Michael Wincott Kevin Reynolds Action Adventure Drama Romance Thriller
1231,Brad Furman,Matthew McConaughey,Margarita Levieva,Frances Fisher,Crime Drama Thriller,the lincoln lawyer,Matthew McConaughey Margarita Levieva Frances Fisher Brad Furman Crime Drama Thriller
1232,Jaume Collet-Serra,Liam Neeson,Frank Langella,Aidan Quinn,Action Mystery Thriller,unknown,Liam Neeson Frank Langella Aidan Quinn Jaume Collet-Serra Action Mystery Thriller
1233,Christopher Nolan,Christian Bale,Hugh Jackman,Scarlett Johansson,Drama Mystery Sci-Fi Thriller,the prestige,Christian Bale Hugh Jackman Scarlett Johansson Christopher Nolan Drama Mystery Sci-Fi Thriller
1234,Sean Anders,Kevin Spacey,Christoph Waltz,Lindsay Sloane,Comedy Crime,horrible bosses 2,Kevin Spacey Christoph Waltz Lindsay Sloane Sean Anders Comedy Crime
1235,Cal Brunker,Brendan Fraser,Paul Scheer,Jonathan Morgan Heit,Adventure Animation Comedy Family Sci-Fi,escape from planet earth,Brendan Fraser Paul Scheer Jonathan Morgan Heit Cal Brunker Adventure Animation Comedy Family Sci-Fi
1236,Mel Gibson,Rudy Youngblood,Dalia Hernández,Jonathan Brewer,Action Adventure Drama Thriller,apocalypto,Rudy Youngblood Dalia Hernández Jonathan Brewer Mel Gibson Action Adventure Drama Thriller
1237,John Glen,Joe Don Baker,Desmond Llewelyn,Art Malik,Action Adventure Thriller,the living daylights,Joe Don Baker Desmond Llewelyn Art Malik John Glen Action Adventure Thriller
1238,Nimród Antal,Topher Grace,Alice Braga,Derek Mears,Action Adventure Sci-Fi Thriller,predators,Topher Grace Alice Braga Derek Mears Nimród Antal Action Adventure Sci-Fi Thriller
1239,Ivan Reitman,Brian Dennehy,Debra Winger,Roscoe Lee Browne,Comedy Crime Romance,legal eagles,Brian Dennehy Debra Winger Roscoe Lee Browne Ivan Reitman Comedy Crime Romance
1240,David Koepp,Johnny Depp,Charles S. Dutton,Timothy Hutton,Mystery Thriller,secret window,Johnny Depp Charles S. Dutton Timothy Hutton David Koepp Mystery Thriller
1241,Alejandro Agresti,Keanu Reeves,Dylan Walsh,Ebon Moss-Bachrach,Drama Fantasy Romance,the lake house,Keanu Reeves Dylan Walsh Ebon Moss-Bachrach Alejandro Agresti Drama Fantasy Romance
1242,Iain Softley,Gena Rowlands,Deneen Tyler,Joy Bryant,Horror Mystery Thriller,the skeleton key,Gena Rowlands Deneen Tyler Joy Bryant Iain Softley Horror Mystery Thriller
1243,Peter Hedges,Jennifer Garner,Odeya Rush,Common,Comedy Drama Family Fantasy,the odd life of timothy green,Jennifer Garner Odeya Rush Common Peter Hedges Comedy Drama Family Fantasy
